<?xml version="1.0" encoding="UTF-8"?>
<calificaciones xmlns:xsi="http://www.w3.org/2001/XMLSchema-instance" xsi:noNamespaceSchemaLocation="_ejercicio_3_pag_195.xsd">
    <alumno>
        <datos>
            <nombre>Felipe</nombre>
            <apellidos>Pascal</apellidos>
        </datos>
        <materia>
            <oace>
                <cuestionario>4</cuestionario>
                <tareas>8</tareas>
            </oace>
            <eee>
                <cuestionario>7</cuestionario>
                <tareas>6</tareas>
            </eee>
            <xml>
                <cuestionario>8</cuestionario>
                <tareas>6</tareas>
            </xml>
        </materia>
    </alumno>
    <alumno>
        <datos>
            <nombre>María</nombre>
            <apellidos>García</apellidos>
        </datos>
        <materia>
            <oace>
                <cuestionario>9</cuestionario>
                <tareas>2</tareas>
            </oace>
            <eee>
                <cuestionario>9</cuestionario>
                <tareas>6</tareas>
            </eee>
            <xml>
                <cuestionario>7</cuestionario>
                <tareas>7</tareas>
            </xml>
        </materia>
    </alumno>
</calificaciones>
